imdb_title_id,original_title,year,genre,duration,director,actors,avg_vote
tt0111161,The Shawshank Redemption,1994,Drama,142,Frank Darabont,"Tim Robbins, Morgan Freeman, Bob Gunton, William Sadler, Clancy Brown, Gil Bellows, Mark Rolston, James Whitmore, Jeffrey DeMunn, Larry Brandenburg, Neil Giuntoli, Brian Libby, David Proval, Joseph Ragno, Jude Ciccolella",9.3
tt0068646,The Godfather,1972,"Crime, Drama",175,Francis Ford Coppola,"Marlon Brando, Al Pacino, James Caan, Richard S. Castellano, Robert Duvall, Sterling Hayden, John Marley, Richard Conte, Al Lettieri, Diane Keaton, Abe Vigoda, Talia Shire, Gianni Russo, John Cazale, Rudy Bond",9.2
tt0071562,The Godfather: Part II,1974,"Crime, Drama",202,Francis Ford Coppola,"Al Pacino, Robert Duvall, Diane Keaton, Robert De Niro, John Cazale, Talia Shire, Lee Strasberg, Michael V. Gazzo, G.D. Spradlin, Richard Bright, Gastone Moschin, Tom Rosqui, Bruno Kirby, Frank Sivero, Francesca De Sapio",9.0
tt0468569,The Dark Knight,2008,"Action, Crime, Drama",152,Christopher Nolan,"Christian Bale, Heath Ledger, Aaron Eckhart, Michael Caine, Maggie Gyllenhaal, Gary Oldman, Morgan Freeman, Monique Gabriela Curnen, Ron Dean, Cillian Murphy, Chin Han, Nestor Carbonell, Eric Roberts, Ritchie Coster, Anthony Michael Hall",9.0
tt0050083,12 Angry Men,1957,"Crime, Drama",96,Sidney Lumet,"Martin Balsam, John Fiedler, Lee J. Cobb, E.G. Marshall, Jack Klugman, Edward Binns, Jack Warden, Henry Fonda, Joseph Sweeney, Ed Begley, George Voskovec, Robert Webber",8.9
tt0108052,Schindler's List,1993,"Biography, Drama, History",195,Steven Spielberg,"Liam Neeson, Ben Kingsley, Ralph Fiennes, Caroline Goodall, Jonathan Sagall, Embeth Davidtz, Malgorzata Gebel, Shmuel Levy, Mark Ivanir, Béatrice Macola, Andrzej Seweryn, Friedrich von Thun, Krzysztof Luft, Harry Nehring, Norbert Weisser",8.9
tt0110912,Pulp Fiction,1994,"Crime, Drama",154,Quentin Tarantino,"Tim Roth, Amanda Plummer, Laura Lovelace, John Travolta, Samuel L. Jackson, Phil LaMarr, Frank Whaley, Burr Steers, Bruce Willis, Ving Rhames, Paul Calderon, Bronagh Gallagher, Rosanna Arquette, Eric Stoltz, Uma Thurman",8.9
tt0167260,The Lord of the Rings: The Return of the King,2003,"Action, Adventure, Drama",201,Peter Jackson,"Noel Appleby, Ali Astin, Sean Astin, David Aston, John Bach, Sean Bean, Cate Blanchett, Orlando Bloom, Billy Boyd, Sadwyn Brophy, Alistair Browning, Marton Csokas, Richard Edge, Jason Fitch, Bernard Hill",8.9
tt0060196,"Il buono, il brutto, il cattivo",1966,Western,161,Sergio Leone,"Eli Wallach, Clint Eastwood, Lee Van Cleef, Aldo Giuffrè, Luigi Pistilli, Rada Rassimov, Enzo Petito, Claudio Scarchilli, John Bartha, Livio Lorenzon, Antonio Casale, Sandro Scarchilli, Benito Stefanelli, Angelo Novi, Antonio Casas",8.8
tt0109830,Forrest Gump,1994,"Drama, Romance",142,Robert Zemeckis,"Tom Hanks, Rebecca Williams, Sally Field, Michael Conner Humphreys, Harold G. Herthum, George Kelly, Bob Penny, John Randall, Sam Anderson, Margo Moorer, Ione M. Telech, Christine Seabrook, John Worsham, Peter Dobson, Siobhan Fallon Hogan",8.8
tt0120737,The Lord of the Rings: The Fellowship of the Ring,2001,"Action, Adventure, Drama",178,Peter Jackson,"Alan Howard, Noel Appleby, Sean Astin, Sala Baker, Sean Bean, Cate Blanchett, Orlando Bloom, Billy Boyd, Marton Csokas, Megan Edwards, Michael Elsworth, Mark Ferguson, Ian Holm, Christopher Lee, Lawrence Makoare",8.8
tt0137523,Fight Club,1999,Drama,139,David Fincher,"Edward Norton, Brad Pitt, Meat Loaf, Zach Grenier, Richmond Arquette, David Andrews, George Maguire, Eugenie Bondurant, Helena Bonham Carter, Christina Cabot, Sydney 'Big Dawg' Colston, Rachel Singer, Christie Cronenweth, Tim DeZarn, Ezra Buzzington",8.8
tt1375666,Inception,2010,"Action, Adventure, Sci-Fi",148,Christopher Nolan,"Leonardo DiCaprio, Joseph Gordon-Levitt, Ellen Page, Tom Hardy, Ken Watanabe, Dileep Rao, Cillian Murphy, Tom Berenger, Marion Cotillard, Pete Postlethwaite, Michael Caine, Lukas Haas, Tai-Li Lee, Claire Geare, Magnus Nolan",8.8
tt5813916,Dag II,2016,"Action, Drama, War",135,Alper Caglar,"Caglar Ertugrul, Ufuk Bayraktar, Ahu Türkpençe, Murat Serezli, Atilgan Gümüs, Murat Arkin, Armagan Oguz, Ahmet Pinar, Açelya Özcan, Bedii Akin, Eylül Arular, Buse Varol, Ozan Agaç, Emir Benderlioglu, Ender Arular",8.8
tt8110330,Dil Bechara,2020,"Comedy, Drama, Romance",101,Mukesh Chhabra,"Sushant Singh Rajput, Sanjana Sanghi, Sahil Vaid, Saswata Chatterjee, Swastika Mukherjee, Sunit Tandon, Saif Ali Khan, Michael Muthu, Rajie Vijay Sarathi, Subbalakshmi, Franaita Jijana, Durgesh Kumar, Salone Mehta, Anandita Sarkar, Nimisha Dean",8.8
tt0073486,One Flew Over the Cuckoo's Nest,1975,Drama,133,Milos Forman,"Jack Nicholson, Louise Fletcher, Will Sampson, Michael Berryman, Alonzo Brown, Peter Brocco, Scatman Crothers, Dean R. Brooks, Mwako Cumbuka, Danny DeVito, William Duell, Josip Elic, Lan Fendors, Nathan George, Ken Kenny",8.7
tt0080684,Star Wars: Episode V - The Empire Strikes Back,1980,"Action, Adventure, Fantasy",124,Irvin Kershner,"Mark Hamill, Harrison Ford, Carrie Fisher, Billy Dee Williams, Anthony Daniels, David Prowse, Peter Mayhew, Kenny Baker, Frank Oz, Alec Guinness, Jeremy Bulloch, John Hollis, Jack Purvis, Des Webb, Clive Revill",8.7
tt0099685,Goodfellas,1990,"Biography, Crime, Drama",146,Martin Scorsese,"Robert De Niro, Ray Liotta, Joe Pesci, Lorraine Bracco, Paul Sorvino, Frank Sivero, Tony Darrow, Mike Starr, Frank Vincent, Chuck Low, Frank DiLeo, Henny Youngman, Gina Mastrogiacomo, Catherine Scorsese, Charles Scorsese",8.7
tt0133093,The Matrix,1999,"Action, Sci-Fi",136,"Lana Wachowski, Lilly Wachowski","Keanu Reeves, Laurence Fishburne, Carrie-Anne Moss, Hugo Weaving, Gloria Foster, Joe Pantoliano, Marcus Chong, Julian Arahanga, Matt Doran, Belinda McClory, Anthony Ray Parker, Paul Goddard, Robert Taylor, David Aston, Marc Aden Gray",8.7
tt0167261,The Lord of the Rings: The Two Towers,2002,"Action, Adventure, Drama",179,Peter Jackson,"Bruce Allpress, Sean Astin, John Bach, Sala Baker, Cate Blanchett, Orlando Bloom, Billy Boyd, Jed Brophy, Sam Comery, Brad Dourif, Calum Gittins, Bernard Hill, Bruce Hopkins, Paris Howe Strewe, Christopher Lee",8.7
tt0038650,It's a Wonderful Life,1946,"Drama, Family, Fantasy",130,Frank Capra,"James Stewart, Donna Reed, Lionel Barrymore, Thomas Mitchell, Henry Travers, Beulah Bondi, Frank Faylen, Ward Bond, Gloria Grahame, H.B. Warner, Frank Albertson, Todd Karns, Samuel S. Hinds, Mary Treen, Virginia Patton",8.6
tt0047478,Shichinin no samurai,1954,"Action, Adventure, Drama",207,Akira Kurosawa,"Toshirô Mifune, Takashi Shimura, Keiko Tsushima, Yukiko Shimazaki, Kamatari Fujiwara, Daisuke Katô, Isao Kimura, Minoru Chiaki, Seiji Miyaguchi, Yoshio Kosugi, Bokuzen Hidari, Yoshio Inaba, Yoshio Tsuchiya, Kokuten Kôdô, Eijirô Tôno",8.6
tt0076759,Star Wars,1977,"Action, Adventure, Fantasy",121,George Lucas,"Mark Hamill, Harrison Ford, Carrie Fisher, Peter Cushing, Alec Guinness, Anthony Daniels, Kenny Baker, Peter Mayhew, David Prowse, Phil Brown, Shelagh Fraser, Jack Purvis, Alex McCrindle, Eddie Byrne, Drewe Henley",8.6
tt0102926,The Silence of the Lambs,1991,"Crime, Drama, Thriller",118,Jonathan Demme,"Jodie Foster, Lawrence A. Bonney, Kasi Lemmons, Lawrence T. Wrentz, Scott Glenn, Anthony Heald, Frankie Faison, Don Brockett, Frank Seals Jr., Stuart Rudin, Anthony Hopkins, Maria Skorobogatov, Jeffrie Lane, Leib Lensky, George 'Red' Schwartz",8.6
tt0114369,Se7en,1995,"Crime, Drama, Mystery",127,David Fincher,"Morgan Freeman, Andrew Kevin Walker, Daniel Zacapa, Brad Pitt, Gwyneth Paltrow, John Cassini, Bob Mack, Peter Crombie, Reg E. Cathey, R. Lee Ermey, George Christy, Endre Hules, Hawthorne James, William Davidson, Bob Collins",8.6
tt0118799,La vita è bella,1997,"Comedy, Drama, Romance",116,Roberto Benigni,"Roberto Benigni, Nicoletta Braschi, Giorgio Cantarini, Giustino Durano, Sergio Bini Bustric, Marisa Paredes, Horst Buchholz, Lidia Alfonsi, Giuliana Lojodice, Amerigo Fontani, Pietro De Silva, Francesco Guzzo, Raffaella Lebboroni, Claudio Alfonsi, Gil Baroni",8.6
tt0120689,The Green Mile,1999,"Crime, Drama, Fantasy",189,Frank Darabont,"Tom Hanks, David Morse, Bonnie Hunt, Michael Clarke Duncan, James Cromwell, Michael Jeter, Graham Greene, Doug Hutchison, Sam Rockwell, Barry Pepper, Jeffrey DeMunn, Patricia Clarkson, Harry Dean Stanton, Dabbs Greer, Eve Brent",8.6
tt0120815,Saving Private Ryan,1998,"Drama, War",169,Steven Spielberg,"Tom Hanks, Tom Sizemore, Edward Burns, Barry Pepper, Adam Goldberg, Vin Diesel, Giovanni Ribisi, Jeremy Davies, Matt Damon, Ted Danson, Paul Giamatti, Dennis Farina, Joerg Stadler, Max Martini, Dylan Bruno",8.6
tt0245429,Sen to Chihiro no kamikakushi,2001,"Animation, Adventure, Family",125,Hayao Miyazaki,"Rumi Hiiragi, Miyu Irino, Mari Natsuki, Takashi Naitô, Yasuko Sawaguchi, Tatsuya Gashûin, Ryûnosuke Kamiki, Yumi Tamai, Yô Ôizumi, Koba Hayashi, Tsunehiko Kamijô, Takehiko Ono, Bunta Sugawara, Shigeru Wakita, Shirô Saitô",8.6
tt0317248,Cidade de Deus,2002,"Crime, Drama",130,"Fernando Meirelles, Kátia Lund","Alexandre Rodrigues, Leandro Firmino, Phellipe Haagensen, Douglas Silva, Jonathan Haagensen, Matheus Nachtergaele, Seu Jorge, Jefechander Suplino, Alice Braga, Emerson Gomes, Edson Oliveira, Michel Gomes, Roberta Rodrigues, Luis Otávio, Kiko Marques",8.6
tt0816692,Interstellar,2014,"Adventure, Drama, Sci-Fi",169,Christopher Nolan,"Ellen Burstyn, Matthew McConaughey, Mackenzie Foy, John Lithgow, Timothée Chalamet, David Oyelowo, Collette Wolfe, Francis X. McCarthy, Bill Irwin, Anne Hathaway, Andrew Borba, Wes Bentley, William Devane, Michael Caine, David Gyasi",8.6
tt6751668,Gisaengchung,2019,"Comedy, Drama, Thriller",132,Bong Joon Ho,"Kang-ho Song, Sun-kyun Lee, Yeo-jeong Jo, Woo-sik Choi, So-dam Park, Jeong-eun Lee, Hye-jin Jang, Myeong-hoon Park, Ji-so Jung, Hyun-jun Jung, Keun-rok Park, Jeong Esuz, Jo Jae-Myeong, Ik-han Jung, Kim Gyu Baek",8.6
tt0021749,City Lights,1931,"Comedy, Drama, Romance",87,Charles Chaplin,"Virginia Cherrill, Florence Lee, Harry Myers, Al Ernest Garcia, Hank Mann, Charles Chaplin",8.5
tt0027977,Modern Times,1936,"Comedy, Drama, Family",87,Charles Chaplin,"Charles Chaplin, Paulette Goddard, Henry Bergman, Tiny Sandford, Chester Conklin, Hank Mann, Stanley Blystone, Al Ernest Garcia, Richard Alexander, Cecil Reynolds, Mira McKinney, Murdock MacQuarrie, Wilfred Lucas, Edward LeSaint, Fred Malatesta",8.5
tt0034583,Casablanca,1942,"Drama, Romance, War",102,Michael Curtiz,"Humphrey Bogart, Ingrid Bergman, Paul Henreid, Claude Rains, Conrad Veidt, Sydney Greenstreet, Peter Lorre, S.Z. Sakall, Madeleine Lebeau, Dooley Wilson, Joy Page, John Qualen, Leonid Kinskey, Curt Bois",8.5
tt0054215,Psycho,1960,"Horror, Mystery, Thriller",109,Alfred Hitchcock,"Anthony Perkins, Vera Miles, John Gavin, Janet Leigh, Martin Balsam, John McIntire, Simon Oakland, Frank Albertson, Patricia Hitchcock, Vaughn Taylor, Lurene Tuttle, John Anderson, Mort Mills",8.5
tt0064116,C'era una volta il West,1968,Western,165,Sergio Leone,"Claudia Cardinale, Henry Fonda, Jason Robards, Charles Bronson, Gabriele Ferzetti, Paolo Stoppa, Woody Strode, Jack Elam, Keenan Wynn, Frank Wolff, Lionel Stander",8.5
tt0088763,Back to the Future,1985,"Adventure, Comedy, Sci-Fi",116,Robert Zemeckis,"Michael J. Fox, Christopher Lloyd, Lea Thompson, Crispin Glover, Thomas F. Wilson, Claudia Wells, Marc McClure, Wendie Jo Sperber, George DiCenzo, Frances Lee McCain, James Tolkan, J.J. Cohen, Casey Siemaszko, Billy Zane, Harry Waters Jr.",8.5
tt0095327,Hotaru no haka,1988,"Animation, Drama, War",89,Isao Takahata,"Tsutomu Tatsumi, Ayano Shiraishi, Yoshiko Shinohara, Akemi Yamaguchi, Tadashi Nakamura, Marcy Bannor, Shelley Calene-Black, Luci Christian, Shannon Conley, Justin Doran, Crispin Freeman, Adam Gibbs, Dan Green, Amy Jones, Susan O. Koozin",8.5
tt0095765,Nuovo Cinema Paradiso,1988,Drama,155,Giuseppe Tornatore,"Antonella Attili, Enzo Cannavale, Isa Danieli, Leo Gullotta, Marco Leonardi, Pupella Maggio, Agnese Nano, Leopoldo Trieste, Salvatore Cascio, Tano Cimarosa, Nicola Di Pinto, Roberta Lena, Nino Terzo, Jacques Perrin, Philippe Noiret",8.5
tt0103064,Terminator 2: Judgment Day,1991,"Action, Sci-Fi",137,James Cameron,"Arnold Schwarzenegger, Linda Hamilton, Edward Furlong, Robert Patrick, Earl Boen, Joe Morton, S. Epatha Merkerson, Castulo Guerra, Danny Cooksey, Jenette Goldstein, Xander Berkeley, Leslie Hamilton Gearren, Ken Gibbel, Robert Winley, Peter Schrum",8.5
tt0110357,The Lion King,1994,"Animation, Adventure, Drama",88,"Roger Allers, Rob Minkoff","Rowan Atkinson, Matthew Broderick, Niketa Calame-Harris, Jim Cummings, Whoopi Goldberg, Robert Guillaume, Jeremy Irons, James Earl Jones, Moira Kelly, Nathan Lane, Zoe Leader, Cheech Marin, Ernie Sabella, Madge Sinclair, Jonathan Taylor Thomas",8.5
tt0110413,Léon,1994,"Action, Crime, Drama",110,Luc Besson,"Jean Reno, Gary Oldman, Natalie Portman, Danny Aiello, Peter Appel, Willi One Blood, Don Creech, Keith A. Glascoe, Randolph Scott, Michael Badalucco, Ellen Greene, Elizabeth Regen, Carl J. Matusovich, Frank Senger, Lucius Wyatt Cherokee",8.5
tt0114814,The Usual Suspects,1995,"Crime, Mystery, Thriller",106,Bryan Singer,"Stephen Baldwin, Gabriel Byrne, Benicio Del Toro, Kevin Pollak, Kevin Spacey, Chazz Palminteri, Pete Postlethwaite, Suzy Amis, Giancarlo Esposito, Dan Hedaya, Paul Bartel, Carl Bressler, Phillipe Simon, Jack Shearer, Christine Estabrook",8.5
tt0120586,American History X,1998,Drama,119,Tony Kaye,"Edward Norton, Edward Furlong, Beverly D'Angelo, Jennifer Lien, Ethan Suplee, Fairuza Balk, Avery Brooks, Elliott Gould, Stacy Keach, William Russ, Guy Torry, Joe Cortese, Jason Bose Smith, Antonio David Lyons, Alex Sol",8.5
tt0172495,Gladiator,2000,"Action, Adventure, Drama",155,Ridley Scott,"Russell Crowe, Joaquin Phoenix, Connie Nielsen, Oliver Reed, Richard Harris, Derek Jacobi, Djimon Hounsou, David Schofield, John Shrapnel, Tomas Arana, Ralf Moeller, Spencer Treat Clark, David Hemmings, Tommy Flanagan, Sven-Ole Thorsen",8.5
tt0253474,The Pianist,2002,"Biography, Drama, Music",150,Roman Polanski,"Adrien Brody, Emilia Fox, Michal Zebrowski, Ed Stoppard, Maureen Lipman, Frank Finlay, Jessica Kate Meyer, Julia Rayner, Wanja Mues, Richard Ridings, Nomi Sharron, Anthony Milner, Lucy Skeaping, Roddy Skeaping, Ben Harlan",8.5
tt0407887,The Departed,2006,"Crime, Drama, Thriller",151,Martin Scorsese,"Leonardo DiCaprio, Matt Damon, Jack Nicholson, Mark Wahlberg, Martin Sheen, Ray Winstone, Vera Farmiga, Anthony Anderson, Alec Baldwin, Kevin Corrigan, James Badge Dale, David O'Hara, Mark Rolston, Robert Wahlberg, Kristen Dalton",8.5
tt0482571,The Prestige,2006,"Drama, Mystery, Sci-Fi",130,Christopher Nolan,"Hugh Jackman, Christian Bale, Michael Caine, Piper Perabo, Rebecca Hall, Scarlett Johansson, Samantha Mahurin, David Bowie, Andy Serkis, Daniel Davis, Jim Piddock, Christopher Neame, Mark Ryan, Roger Rees, Jamie Harris",8.5
tt1675434,Intouchables,2011,"Biography, Comedy, Drama",112,"Olivier Nakache, Éric Toledano","François Cluzet, Omar Sy, Anne Le Ny, Audrey Fleurot, Joséphine de Meaux, Clotilde Mollet, Alba Gaïa Bellugi, Cyril Mendy, Salimata Kamate, Absa Diatou Toure, Grégoire Oestermann, Dominique Daguier, François Caron, Christian Ameri, Thomas Solivérès",8.5
tt2582802,Whiplash,2014,"Drama, Music",106,Damien Chazelle,"Miles Teller, J.K. Simmons, Paul Reiser, Melissa Benoist, Austin Stowell, Nate Lang, Chris Mulkey, Damon Gupton, Suanne Spoke, Max Kasch, Charlie Ian, Jayson Blair, Kofi Siriboe, Kavita Patil, C.J. Vana",8.5
tt7286456,Joker,2019,"Crime, Drama, Thriller",122,Todd Phillips,"Joaquin Phoenix, Robert De Niro, Zazie Beetz, Frances Conroy, Brett Cullen, Shea Whigham, Bill Camp, Glenn Fleshler, Leigh Gill, Josh Pais, Rocco Luna, Marc Maron, Sondra James, Murphy Guyer, Douglas Hodge",8.5
tt0032553,The Great Dictator,1940,"Comedy, Drama, War",125,Charles Chaplin,"Charles Chaplin, Jack Oakie, Reginald Gardiner, Henry Daniell, Billy Gilbert, Grace Hayle, Carter DeHaven, Paulette Goddard, Maurice Moscovitch, Emma Dunn, Bernard Gorcey, Paul Weigel, Chester Conklin, Esther Michelson, Hank Mann",8.4
tt0043014,Sunset Blvd.,1950,"Drama, Film-Noir",110,Billy Wilder,"William Holden, Gloria Swanson, Erich von Stroheim, Nancy Olson, Fred Clark, Lloyd Gough, Jack Webb, Franklyn Farnum, Larry J. Blake, Charles Dayton, Cecil B. DeMille, Hedda Hopper, Buster Keaton, Anna Q. Nilsson, H.B. Warner",8.4
tt0047396,Rear Window,1954,"Mystery, Thriller",112,Alfred Hitchcock,"James Stewart, Grace Kelly, Wendell Corey, Thelma Ritter, Raymond Burr, Judith Evelyn, Ross Bagdasarian, Georgine Darcy, Sara Berner, Frank Cady, Jesslyn Fax, Rand Harper, Irene Winston, Havis Davenport",8.4
tt0050825,Paths of Glory,1957,"Drama, War",88,Stanley Kubrick,"Kirk Douglas, Ralph Meeker, Adolphe Menjou, George Macready, Wayne Morris, Richard Anderson, Joe Turkel, Christiane Kubrick, Jerry Hausner, Peter Capell, Emile Meyer, Bert Freed, Kem Dibbs, Timothy Carey, Fred Bell",8.4
tt0051201,Witness for the Prosecution,1957,"Crime, Drama, Mystery",116,Billy Wilder,"Tyrone Power, Marlene Dietrich, Charles Laughton, Elsa Lanchester, John Williams, Henry Daniell, Ian Wolfe, Torin Thatcher, Norma Varden, Una O'Connor, Francis Compton, Philip Tonge, Ruta Lee",8.4
tt0057012,Dr. Strangelove or: How I Learned to Stop Worrying and Love the Bomb,1964,Comedy,95,Stanley Kubrick,"Peter Sellers, George C. Scott, Sterling Hayden, Keenan Wynn, Slim Pickens, Peter Bull, James Earl Jones, Tracy Reed, Jack Creley, Frank Berry, Robert O'Neil, Glenn Beck, Roy Stephens, Shane Rimmer, Hal Galili",8.4
tt0078748,Alien,1979,"Horror, Sci-Fi",117,Ridley Scott,"Tom Skerritt, Sigourney Weaver, Veronica Cartwright, Harry Dean Stanton, John Hurt, Ian Holm, Yaphet Kotto, Bolaji Badejo, Helen Horton",8.4
tt0078788,Apocalypse Now,1979,"Drama, Mystery, War",147,Francis Ford Coppola,"Marlon Brando, Martin Sheen, Robert Duvall, Frederic Forrest, Sam Bottoms, Laurence Fishburne, Albert Hall, Harrison Ford, Dennis Hopper, G.D. Spradlin, Jerry Ziesmer, Scott Glenn, Bo Byers, James Keane, Kerry Rossall",8.4
tt0081505,The Shining,1980,"Drama, Horror",146,Stanley Kubrick,"Jack Nicholson, Shelley Duvall, Danny Lloyd, Scatman Crothers, Barry Nelson, Philip Stone, Joe Turkel, Anne Jackson, Tony Burton, Lia Beldam, Billie Gibson, Barry Dennen, David Baxt, Manning Redwood, Lisa Burns",8.4
tt0082971,Raiders of the Lost Ark,1981,"Action, Adventure",115,Steven Spielberg,"Harrison Ford, Karen Allen, Paul Freeman, Ronald Lacey, John Rhys-Davies, Denholm Elliott, Alfred Molina, Wolf Kahler, Anthony Higgins, Vic Tablian, Don Fellows, William Hootkins, Bill Reimbold, Fred Sorenson, Patrick Durkin",8.4
tt0087843,Once Upon a Time in America,1984,"Crime, Drama",229,Sergio Leone,"Robert De Niro, James Woods, Elizabeth McGovern, Treat Williams, Tuesday Weld, Burt Young, Joe Pesci, Danny Aiello, William Forsythe, James Hayden, Darlanne Fluegel, Larry Rapp, Dutch Miller, Robert Harper, Richard Bright",8.4
tt0119698,Mononoke-hime,1997,"Animation, Adventure, Fantasy",134,Hayao Miyazaki,"Billy Crudup, Billy Bob Thornton, Minnie Driver, John DiMaggio, Claire Danes, John DeMita, Jada Pinkett Smith, Gillian Anderson, Keith David, Corey Burton, Tara Strong, Julia Fletcher, Debi Derryberry, Alex Fernandez, Jack Fletcher",8.4
tt0209144,Memento,2000,"Mystery, Thriller",113,Christopher Nolan,"Guy Pearce, Carrie-Anne Moss, Joe Pantoliano, Mark Boone Junior, Russ Fega, Jorja Fox, Stephen Tobolowsky, Harriet Sansom Harris, Thomas Lennon, Callum Keith Rennie, Kimberly Campbell, Marianne Muellerleile, Larry Holden",8.4
tt0364569,Oldeuboi,2003,"Action, Drama, Mystery",120,Chan-wook Park,"Min-sik Choi, Ji-Tae Yoo, Hye-jeong Kang, Dae-han Ji, Dal-su Oh, Byeong-ok Kim, Seung-shin Lee, Jin-Seo Yoon, Dae-yeon Lee, Kwang-rok Oh, Tae-kyung Oh, Yeon-Seok Yoo, Il-han Oo, Su-hyeon Kim, Seung-jin Lee",8.4
tt0405094,Das Leben der Anderen,2006,"Drama, Mystery, Thriller",137,Florian Henckel von Donnersmarck,"Martina Gedeck, Ulrich Mühe, Sebastian Koch, Ulrich Tukur, Thomas Thieme, Hans-Uwe Bauer, Volkmar Kleinert, Matthias Brenner, Charly Hübner, Herbert Knaup, Bastian Trost, Marie Gruber, Volker Michalowski, Werner Daehn, Martin Brambach",8.4
tt0910970,WALL·E,2008,"Animation, Adventure, Family",98,Andrew Stanton,"Ben Burtt, Elissa Knight, Jeff Garlin, Fred Willard, MacInTalk, John Ratzenberger, Kathy Najimy, Sigourney Weaver, Teddy Newton, Bob Bergen, John Cygan, Pete Docter, Paul Eiding, Donald Fullilove, Teresa Ganzel",8.4
tt0986264,Taare Zameen Par,2007,"Drama, Family",165,"Aamir Khan, Amole Gupte","Darsheel Safary, Aamir Khan, Tisca Chopra, Vipin Sharma, Sachet Engineer, Tanay Chheda, Lalitha Lajmi, Girija Oak, Ravi Khanvilkar, Pratima Kulkarni, Meghna Malik, Sonali Sachdev, Sanjay Dadich, Raaj Gopal Iyer, Bugs Bhargava",8.4
tt1187043,3 Idiots,2009,"Comedy, Drama",170,Rajkumar Hirani,"Aamir Khan, Madhavan, Sharman Joshi, Kareena Kapoor, Boman Irani, Omi Vaidya, Mona Singh, Olivier Lafont, Rahul Kumar, Parikshit Sahni, Farida Dadi, Amardeep Jha, Mukund Bhatt, Chaitali Bose, Javed Jaffrey",8.4
tt1345836,The Dark Knight Rises,2012,"Action, Adventure",164,Christopher Nolan,"Christian Bale, Gary Oldman, Tom Hardy, Joseph Gordon-Levitt, Anne Hathaway, Marion Cotillard, Morgan Freeman, Michael Caine, Matthew Modine, Alon Aboutboul, Ben Mendelsohn, Burn Gorman, Daniel Sunjata, Aidan Gillen, Sam Kennard",8.4
tt1853728,Django Unchained,2012,"Drama, Western",165,Quentin Tarantino,"Jamie Foxx, Christoph Waltz, Leonardo DiCaprio, Kerry Washington, Samuel L. Jackson, Walton Goggins, Dennis Christopher, James Remar, David Steen, Dana Gourrier, Nichole Galicia, Laura Cayouette, Ato Essandoh, Sammi Rotibi, Clay Donahue Fontenot",8.4
tt2380307,Coco,2017,"Animation, Adventure, Family",105,"Lee Unkrich, Adrian Molina","Anthony Gonzalez, Gael García Bernal, Benjamin Bratt, Alanna Ubach, Renee Victor, Jaime Camil, Alfonso Arau, Herbert Siguenza, Gabriel Iglesias, Lombardo Boyar, Ana Ofelia Murguía, Natalia Cordova-Buckley, Selene Luna, Edward James Olmos, Sofía Espinosa",8.4
tt4154756,Avengers: Infinity War,2018,"Action, Adventure, Sci-Fi",149,"Anthony Russo, Joe Russo","Robert Downey Jr., Chris Hemsworth, Mark Ruffalo, Chris Evans, Scarlett Johansson, Don Cheadle, Benedict Cumberbatch, Tom Holland, Chadwick Boseman, Zoe Saldana, Karen Gillan, Tom Hiddleston, Paul Bettany, Elizabeth Olsen, Anthony Mackie",8.4
tt4154796,Avengers: Endgame,2019,"Action, Adventure, Drama",181,"Anthony Russo, Joe Russo","Robert Downey Jr., Chris Evans, Mark Ruffalo, Chris Hemsworth, Scarlett Johansson, Jeremy Renner, Don Cheadle, Paul Rudd, Benedict Cumberbatch, Chadwick Boseman, Brie Larson, Tom Holland, Karen Gillan, Zoe Saldana, Evangeline Lilly",8.4
tt4633694,Spider-Man: Into the Spider-Verse,2018,"Animation, Action, Adventure",117,"Bob Persichetti, Peter Ramsey","Shameik Moore, Jake Johnson, Hailee Steinfeld, Mahershala Ali, Brian Tyree Henry, Lily Tomlin, Luna Lauren Velez, Zoë Kravitz, John Mulaney, Kimiko Glenn, Nicolas Cage, Kathryn Hahn, Liev Schreiber, Chris Pine, Natalie Morales",8.4
tt5074352,Dangal,2016,"Action, Biography, Drama",161,Nitesh Tiwari,"Aamir Khan, Fatima Sana Shaikh, Sanya Malhotra, Sakshi Tanwar, Aparshakti Khurana, Zaira Wasim, Suhani Bhatnagar, Ritvik Sahore, Girish Kulkarni, Ravi Aneja, Anurag Arora, Mahesh Balraj, Vivan Bhatena, Anmol Charan, Karamveer Choudhary",8.4
tt5311514,Kimi no na wa.,2016,"Animation, Drama, Fantasy",106,Makoto Shinkai,"Ryûnosuke Kamiki, Mone Kamishiraishi, Ryô Narita, Aoi Yûki, Nobunaga Shimazaki, Kaito Ishikawa, Kanon Tani, Masaki Terasoma, Sayaka Ôhara, Kazuhiko Inoue, Chafûrin, Kana Hanazawa, Yuka Terasaki, Takashi Onozuka, Yôhei Namekawa",8.4
tt8267604,Capharnaüm,2018,Drama,126,Nadine Labaki,"Zain Al Rafeea, Yordanos Shiferaw, Boluwatife Treasure Bankole, Kawsar Al Haddad, Fadi Yousef, Cedra Izzam, Alaa Chouchnieh, Elias Khoury, Mohammad Al Abdallah, Mohamad Abdellatif, Abdo Abdo, Hampig Abraham, Jamil Ahmad, Mohamad Akkar, Elias Akobegia",8.4
tt0012349,The Kid,1921,"Comedy, Drama, Family",68,Charles Chaplin,"Carl Miller, Edna Purviance, Jackie Coogan, Charles Chaplin",8.3
tt0017136,Metropolis,1927,"Drama, Sci-Fi",153,Fritz Lang,"Alfred Abel, Gustav Fröhlich, Rudolf Klein-Rogge, Fritz Rasp, Theodor Loos, Erwin Biswanger, Heinrich George, Brigitte Helm",8.3
tt0022100,M - Eine Stadt sucht einen Mörder,1931,"Crime, Mystery, Thriller",117,Fritz Lang,"Peter Lorre, Ellen Widmann, Inge Landgut, Otto Wernicke, Theodor Loos, Gustaf Gründgens, Friedrich Gnaß, Fritz Odemar, Paul Kemp, Theo Lingen, Rudolf Blümner, Georg John, Franz Stein, Ernst Stahl-Nachbaur, Gerhard Bienert",8.3
tt0033467,Citizen Kane,1941,"Drama, Mystery",119,Orson Welles,"Joseph Cotten, Dorothy Comingore, Agnes Moorehead, Ruth Warrick, Ray Collins, Erskine Sanford, Everett Sloane, William Alland, Paul Stewart, George Coulouris, Fortunio Bonanova, Gus Schilling, Philip Van Zandt, Georgia Backus, Harry Shannon",8.3
tt0036775,Double Indemnity,1944,"Crime, Drama, Film-Noir",107,Billy Wilder,"Fred MacMurray, Barbara Stanwyck, Edward G. Robinson, Porter Hall, Jean Heather, Tom Powers, Byron Barr, Richard Gaines, Fortunio Bonanova, John Philliber",8.3
tt0040522,Ladri di biciclette,1948,Drama,89,Vittorio De Sica,"Lamberto Maggiorani, Enzo Staiola, Lianella Carell, Elena Altieri, Gino Saltamerenda, Giulio Chiari, Vittorio Antonucci, Michele Sakara, Fausto Guerzoni, Emma Druetti, Carlo Jachino",8.3
tt0044741,Ikiru,1952,Drama,143,Akira Kurosawa,"Takashi Shimura, Shin'ichi Himori, Haruo Tanaka, Minoru Chiaki, Miki Odagiri, Bokuzen Hidari, Minosuke Yamada, Kamatari Fujiwara, Makoto Kobori, Nobuo Kaneko, Nobuo Nakamura, Atsushi Watanabe, Isao Kimura, Masao Shimizu, Yûnosuke Itô",8.3
tt0045152,Singin' in the Rain,1952,"Comedy, Musical, Romance",103,"Stanley Donen, Gene Kelly","Gene Kelly, Donald O'Connor, Debbie Reynolds, Jean Hagen, Millard Mitchell, Cyd Charisse, Douglas Fowley, Rita Moreno",8.3
