imdb_title_id,original_title,year,genre,duration,director,actors,avg_vote
tt0052357,Vertigo,1958,"Mystery, Romance, Thriller",128,Alfred Hitchcock,"James Stewart, Kim Novak, Barbara Bel Geddes, Tom Helmore, Henry Jones, Raymond Bailey, Ellen Corby, Konstantin Shayne, Lee Patrick",8.3
tt0053125,North by Northwest,1959,"Adventure, Mystery, Thriller",136,Alfred Hitchcock,"Cary Grant, Eva Marie Saint, James Mason, Jessie Royce Landis, Leo G. Carroll, Josephine Hutchinson, Philip Ober, Martin Landau, Adam Williams, Edward Platt, Robert Ellenstein, Les Tremayne, Philip Coolidge, Patrick McVey, Edward Binns",8.3
tt0053604,The Apartment,1960,"Comedy, Drama, Romance",125,Billy Wilder,"Jack Lemmon, Shirley MacLaine, Fred MacMurray, Ray Walston, Jack Kruschen, David Lewis, Hope Holiday, Joan Shawlee, Naomi Stevens, Johnny Seven, Joyce Jameson, Willard Waterman, David White, Edie Adams",8.3
tt0056172,Lawrence of Arabia,1962,"Adventure, Biography, Drama",228,David Lean,"Peter O'Toole, Alec Guinness, Anthony Quinn, Jack Hawkins, Omar Sharif, José Ferrer, Anthony Quayle, Claude Rains, Arthur Kennedy, Donald Wolfit, I.S. Johar, Gamil Ratib, Michel Ray, John Dimech, Zia Mohyeddin",8.3
tt0059578,Per qualche dollaro in più,1965,Western,132,Sergio Leone,"Clint Eastwood, Lee Van Cleef, Gian Maria Volontè, Mara Krupp, Luigi Pistilli, Klaus Kinski, Luis Rodríguez, Benito Stefanelli, Panos Papadopulos, Aldo Sambrell, Roberto Camardiel, Joseph Egger, Tomás Blanco, Lorenzo Robledo, Dante Maggio",8.3
tt0062622,2001: A Space Odyssey,1968,"Adventure, Sci-Fi",149,Stanley Kubrick,"Keir Dullea, Gary Lockwood, William Sylvester, Daniel Richter, Leonard Rossiter, Margaret Tyzack, Robert Beatty, Sean Sullivan, Douglas Rain, Frank Miller, Bill Weston, Ed Bishop, Glenn Beck, Alan Gifford, Ann Gillis",8.3
tt0066921,A Clockwork Orange,1971,"Crime, Drama, Sci-Fi",136,Stanley Kubrick,"Malcolm McDowell, Patrick Magee, Michael Bates, Warren Clarke, John Clive, Adrienne Corri, Carl Duering, Paul Farrell, Clive Francis, Michael Gover, Miriam Karlin, James Marcus, Aubrey Morris, Godfrey Quigley, Sheila Raynor",8.3
tt0070735,The Sting,1973,"Comedy, Crime, Drama",129,George Roy Hill,"Paul Newman, Robert Redford, Robert Shaw, Charles Durning, Ray Walston, Eileen Brennan, Harold Gould, John Heffernan, Dana Elcar, Jack Kehoe, Dimitra Arliss, Robert Earl Jones, James Sloyan, Charles Dierkop, Lee Paul",8.3
tt0075314,Taxi Driver,1976,"Crime, Drama",114,Martin Scorsese,"Diahnne Abbott, Frank Adu, Victor Argo, Gino Ardito, Garth Avery, Peter Boyle, Albert Brooks, Harry Cohn, Copper Cunningham, Robert De Niro, Brenda Dickson, Harry Fischler, Jodie Foster, Nat Grant, Leonard Harris",8.3
tt0082096,Das Boot,1981,"Adventure, Drama, Thriller",149,Wolfgang Petersen,"Jürgen Prochnow, Herbert Grönemeyer, Klaus Wennemann, Hubertus Bengsch, Martin Semmelrogge, Bernd Tauber, Erwin Leder, Martin May, Heinz Hoenig, Uwe Ochsenknecht, Claude-Oliver Rudolph, Jan Fedder, Ralf Richter, Joachim Bernhard, Oliver Stritzel",8.3
tt0086190,Star Wars: Episode VI - Return of the Jedi,1983,"Action, Adventure, Fantasy",131,Richard Marquand,"Mark Hamill, Harrison Ford, Carrie Fisher, Billy Dee Williams, Anthony Daniels, Peter Mayhew, Sebastian Shaw, Ian McDiarmid, Frank Oz, James Earl Jones, David Prowse, Alec Guinness, Kenny Baker, Michael Pennington, Kenneth Colley",8.3
tt0086250,Scarface,1983,"Crime, Drama",170,Brian De Palma,"Al Pacino, Steven Bauer, Michelle Pfeiffer, Mary Elizabeth Mastrantonio, Robert Loggia, Miriam Colon, F. Murray Abraham, Paul Shenar, Harris Yulin, Ángel Salazar, Arnaldo Santana, Pepe Serna, Michael P. Moran, Al Israel, Dennis Holahan",8.3
tt0086879,Amadeus,1984,"Biography, Drama, History",160,Milos Forman,"F. Murray Abraham, Tom Hulce, Elizabeth Berridge, Roy Dotrice, Simon Callow, Christine Ebersole, Jeffrey Jones, Charles Kay, Kenneth McMillan, Kenny Baker, Lisbeth Bartlett, Barbara Bryne, Martin Cavina, Roderick Cook, Milan Demjanenko",8.3
